{
  "$schema": "https://json-schema.org/draft/2020-12/schema",
  "$id": "https://raw.githubusercontent.com/getsentry/MobileBuildMCP/main/schemas/structured-output/mobilebuildmcp.output.debug-session-action/2.schema.json",
  "type": "object",
  "additionalProperties": false,
  "allOf": [
    {
      "$ref": "https://raw.githubusercontent.com/getsentry/MobileBuildMCP/main/schemas/structured-output/_defs/common.schema.json#/$defs/errorConsistency"
    }
  ],
  "properties": {
    "schema": {
      "const": "mobilebuildmcp.output.debug-session-action"
    },
    "schemaVersion": {
      "const": "2"
    },
    "didError": {
      "type": "boolean"
    },
    "error": {
      "type": [
        "string",
        "null"
      ]
    },
    "data": {
      "type": "object",
      "additionalProperties": false,
      "properties": {
        "action": {
          "enum": [
            "attach",
            "continue",
            "detach"
          ]
        },
        "session": {
          "type": "object",
          "additionalProperties": false,
          "properties": {
            "debugSessionId": {
              "type": "string"
            },
            "connectionState": {
              "enum": [
                "attached",
                "detached"
              ]
            },
            "executionState": {
              "enum": [
                "paused",
                "running"
              ]
            }
          },
          "required": [
            "debugSessionId",
            "connectionState"
          ]
        },
        "artifacts": {
          "type": "object",
          "additionalProperties": false,
          "properties": {
            "simulatorId": {
              "type": "string"
            },
            "processId": {
              "type": "integer",
              "minimum": 1
            }
          },
          "required": [],
          "minProperties": 1
        },
        "diagnostics": {
          "$ref": "https://raw.githubusercontent.com/getsentry/MobileBuildMCP/main/schemas/structured-output/_defs/common.schema.json#/$defs/basicDiagnostics"
        }
      },
      "required": [
        "action"
      ]
    },
    "nextSteps": {
      "$ref": "https://raw.githubusercontent.com/getsentry/MobileBuildMCP/main/schemas/structured-output/_defs/common.schema.json#/$defs/nextSteps"
    }
  },
  "required": [
    "schema",
    "schemaVersion",
    "didError",
    "error",
    "data"
  ]
}
