{
  "schema": "mobilebuildmcp.output.debug-session-action",
  "schemaVersion": "2",
  "didError": false,
  "error": null,
  "data": {
    "action": "attach",
    "session": {
      "debugSessionId": "<UUID>",
      "connectionState": "attached",
      "executionState": "paused"
    },
    "artifacts": {
      "simulatorId": "<UUID>",
      "processId": 99999
    }
  },
  "nextSteps": [
    "Add a breakpoint: mobilebuildmcp debugging add-breakpoint --debug-session-id <UUID> --file ... --line 123",
    "Continue execution: mobilebuildmcp debugging continue --debug-session-id <UUID>",
    "Show call stack: mobilebuildmcp debugging stack --debug-session-id <UUID>"
  ]
}
